{"$schema":"https://json-schema.org/draft/2020-12/schema","type":"array","items":{"type":"object","required":["bvId","collectedAt","collectionSource","fetchStatus","contentSha256"],"properties":{"bvId":{"type":"string","pattern":"^BV[0-9A-Za-z]{10}$"},"collectedAt":{"type":"string","format":"date-time"},"collectionSource":{"enum":["MANUAL","AUTO","UNKNOWN"]},"viewCount":{"type":["integer","null"],"minimum":0},"danmakuCount":{"type":["integer","null"],"minimum":0},"replyCount":{"type":["integer","null"],"minimum":0},"favoriteCount":{"type":["integer","null"],"minimum":0},"coinCount":{"type":["integer","null"],"minimum":0},"shareCount":{"type":["integer","null"],"minimum":0},"likeCount":{"type":["integer","null"],"minimum":0},"fetchStatus":{"enum":["success","partial","failed"]},"errorMessage":{"type":["string","null"]},"contentSha256":{"type":"string","pattern":"^[0-9a-f]{64}$"}}}}
