[{"bvId":"BV1xx411c7mD","collectedAt":"2026-01-01T00:00:00Z","collectionSource":"MANUAL","viewCount":9223372036854775807,"danmakuCount":2,"replyCount":3,"favoriteCount":4,"coinCount":5,"shareCount":6,"likeCount":7,"fetchStatus":"success","errorMessage":null,"contentSha256":"318cd595b1418c7d864ef1fe1575049756609665e8a5c6a07c078be24a19c2a4"}]
